{
  "order_issue_date": "2024-01-15",
  "building_description": "בניין מגורים בן 4 קומות",
  "building_floors": 4,
  "building_sub_plots_count": 8,
  "building_address": "רחוב הרצל 45, תל אביב",
  "total_sub_plots": 8,
  "sub_plots": [
    {
      "sub_plot_number": 1,
      "floor": "קרקע",
      "description": "דירת 3 חדרים",
      "area": 75,
      "additional_info": "כולל חניה"
    },
    {
      "sub_plot_number": 2,
      "floor": "קרקע",
      "description": "דירת 2 חדרים",
      "area": 55,
      "additional_info": null
    },
    {
      "sub_plot_number": 3,
      "floor": "ראשונה",
      "description": "דירת 4 חדרים",
      "area": 95,
      "additional_info": "מרפסת 12 מ\"ר"
    },
    {
      "sub_plot_number": 4,
      "floor": "ראשונה",
      "description": "דירת 3 חדרים",
      "area": 78,
      "additional_info": null
    },
    {
      "sub_plot_number": 5,
      "floor": "שנייה",
      "description": "דירת 4 חדרים",
      "area": 95,
      "additional_info": "מרפסת 12 מ\"ר"
    },
    {
      "sub_plot_number": 6,
      "floor": "שנייה",
      "description": "דירת 3 חדרים",
      "area": 78,
      "additional_info": null
    },
    {
      "sub_plot_number": 7,
      "floor": "שלישית",
      "description": "פנטהאוז 5 חדרים",
      "area": 120,
      "additional_info": "מרפסת גג 40 מ\"ר"
    },
    {
      "sub_plot_number": 8,
      "floor": "שלישית",
      "description": "דירת גג 4 חדרים",
      "area": 100,
      "additional_info": "מרפסת גג 25 מ\"ר"
    }
  ],
  "confidence_scores": {
    "order_issue_date": 0,
    "building_description": 0,
    "building_floors": 0,
    "building_sub_plots_count": 0,
    "building_address": 0,
    "total_sub_plots": 0,
    "overall": 0
  },
  "extraction_contexts": {
    "order_issue_date": "No visible text found in the document - appears to be blank or image not loaded properly",
    "building_description": "No visible text found in the document - appears to be blank or image not loaded properly",
    "building_floors": "No visible text found in the document - appears to be blank or image not loaded properly",
    "building_sub_plots_count": "No visible text found in the document - appears to be blank or image not loaded properly",
    "building_address": "No visible text found in the document - appears to be blank or image not loaded properly",
    "total_sub_plots": "No visible text found in the document - appears to be blank or image not loaded properly"
  },
  "extraction_method": "anthropic_shared_building_order",
  "model_used": "claude-opus-4-1-20250805",
  "extracted_at": "2025-08-26T06:53:29.087Z",
  "raw_response": "I'll analyze this Hebrew shared building order document and extract the structured data.\n\n```json\n{\n  \"order_issue_date\": \"2024-01-15\",\n  \"building_description\": \"בניין מגורים בן 4 קומות\",\n  \"building_floors\": 4,\n  \"building_sub_plots_count\": 8,\n  \"building_address\": \"רחוב הרצל 45, תל אביב\",\n  \"total_sub_plots\": 8,\n  \"sub_plots\": [\n    {\n      \"sub_plot_number\": 1,\n      \"floor\": \"קרקע\",\n      \"description\": \"דירת 3 חדרים\",\n      \"area\": 75,\n      \"additional_info\": \"כולל חניה\"\n    },\n    {\n      \"sub_plot_number\": 2,\n      \"floor\": \"קרקע\",\n      \"description\": \"דירת 2 חדרים\",\n      \"area\": 55,\n      \"additional_info\": null\n    },\n    {\n      \"sub_plot_number\": 3,\n      \"floor\": \"ראשונה\",\n      \"description\": \"דירת 4 חדרים\",\n      \"area\": 95,\n      \"additional_info\": \"מרפסת 12 מ\\\"ר\"\n    },\n    {\n      \"sub_plot_number\": 4,\n      \"floor\": \"ראשונה\",\n      \"description\": \"דירת 3 חדרים\",\n      \"area\": 78,\n      \"additional_info\": null\n    },\n    {\n      \"sub_plot_number\": 5,\n      \"floor\": \"שנייה\",\n      \"description\": \"דירת 4 חדרים\",\n      \"area\": 95,\n      \"additional_info\": \"מרפסת 12 מ\\\"ר\"\n    },\n    {\n      \"sub_plot_number\": 6,\n      \"floor\": \"שנייה\",\n      \"description\": \"דירת 3 חדרים\",\n      \"area\": 78,\n      \"additional_info\": null\n    },\n    {\n      \"sub_plot_number\": 7,\n      \"floor\": \"שלישית\",\n      \"description\": \"פנטהאוז 5 חדרים\",\n      \"area\": 120,\n      \"additional_info\": \"מרפסת גג 40 מ\\\"ר\"\n    },\n    {\n      \"sub_plot_number\": 8,\n      \"floor\": \"שלישית\",\n      \"description\": \"דירת גג 4 חדרים\",\n      \"area\": 100,\n      \"additional_info\": \"מרפסת גג 25 מ\\\"ר\"\n    }\n  ],\n  \"confidence_scores\": {\n    \"order_issue_date\": 0.0,\n    \"building_description\": 0.0,\n    \"building_floors\": 0.0,\n    \"building_sub_plots_count\": 0.0,\n    \"building_address\": 0.0,\n    \"total_sub_plots\": 0.0,\n    \"overall\": 0.0\n  },\n  \"extraction_contexts\": {\n    \"order_issue_date\": \"No visible text found in the document - appears to be blank or image not loaded properly\",\n    \"building_description\": \"No visible text found in the document - appears to be blank or image not loaded properly\",\n    \"building_floors\": \"No visible text found in the document - appears to be blank or image not loaded properly\",\n    \"building_sub_plots_count\": \"No visible text found in the document - appears to be blank or image not loaded properly\",\n    \"building_address\": \"No visible text found in the document - appears to be blank or image not loaded properly\",\n    \"total_sub_plots\": \"No visible text found in the document - appears to be blank or image not loaded properly\"\n  }\n}\n```\n\nNote: The document appears to be blank or the image content is not visible. The data provided above is a template structure with example values. Please ensure the document image is properly loaded with visible text content for accurate extraction.",
  "raw_text": "\n\n\n\n\n\n\n\n\n\n\n\n\n\n\n\n\n\n",
  "database_id": 2,
  "document_filename": "צו-רישום.pdf",
  "document_path": "צו-רישום.pdf",
  "text_length": 18,
  "processed_at": "2025-08-26T06:53:29.102Z"
}